{
  "$schema": "https://json-schema.org/draft/2020-12/schema",
  "$id": "urn:promptforge:compiler-output:1.0.0",
  "title": "CompilerOutput",
  "description": "Contract for the normalized output of the PromptForge compiler model. This schema is embedded in the compiler system prompt and is what the model must produce. It deliberately contains NO client-owned identifiers: task_id, project_id and schema_version are assigned by the client during enrichment and must not appear here. Unknown fields are rejected. Lifecycle: raw provider response → JSON extraction & normalization → validation against THIS schema → optional bounded repair (max 1) → client enrichment → validation against taskspec.schema.json → deterministic rendering → persistence. See docs/TASKSPEC.md.",
  "type": "object",
  "additionalProperties": false,
  "required": [
    "task_type",
    "execution_mode",
    "target_provider",
    "objective",
    "scope",
    "acceptance_criteria",
    "risk_level"
  ],
  "properties": {
    "task_type": {
      "enum": [
        "planning",
        "feature",
        "ui",
        "backend",
        "database",
        "integration",
        "bugfix",
        "refactor",
        "review",
        "security",
        "testing",
        "deployment"
      ],
      "description": "Classification of the requested work. Drives context-selection heuristics and renderer emphasis."
    },
    "execution_mode": {
      "enum": [
        "quick",
        "standard",
        "deep",
        "review",
        "plan"
      ],
      "description": "Resolved depth of this compilation. The UI-level 'auto' value is resolved before compilation and never appears here."
    },
    "target_provider": {
      "enum": [
        "qwen",
        "codex",
        "claude"
      ],
      "description": "Default provider for copy/open/save actions. All three renderings are always produced; this field only selects the primary one."
    },
    "objective": {
      "type": "string",
      "minLength": 10,
      "maxLength": 500,
      "description": "One explicit sentence describing the outcome the coding agent must achieve."
    },
    "user_value": {
      "type": "string",
      "maxLength": 500,
      "description": "Why this task matters to the user or product. Optional but encouraged."
    },
    "current_state": {
      "type": "array",
      "items": { "type": "string", "minLength": 1, "maxLength": 500 },
      "maxItems": 50,
      "default": [],
      "description": "Known facts about the project's current state that are material to this task. Facts only, no assumptions."
    },
    "relevant_context": {
      "type": "array",
      "items": { "type": "string", "minLength": 1, "maxLength": 256 },
      "maxItems": 20,
      "default": [],
      "description": "Repository-relative file paths the agent should read before starting (typically .promptforge/context/*.md files). Must only reference context actually supplied with the task."
    },
    "assumptions": {
      "type": "array",
      "items": { "type": "string", "minLength": 1, "maxLength": 500 },
      "maxItems": 20,
      "default": [],
      "description": "Decisions the compiler made without asking, each phrased so the user can veto it. Surfaced verbatim in the rendered prompt."
    },
    "blocking_questions": {
      "type": "array",
      "items": { "type": "string", "minLength": 1, "maxLength": 500 },
      "maxItems": 3,
      "default": [],
      "description": "At most three questions that block correct execution. Only for the product spec's 'must ask' categories (billing provider, data deletion/migration, architecture-changing choices, authorization rules, ambiguous user intent)."
    },
    "scope": {
      "type": "array",
      "items": { "type": "string", "minLength": 1, "maxLength": 500 },
      "minItems": 1,
      "maxItems": 50,
      "description": "Concrete, bounded work items the agent must implement."
    },
    "out_of_scope": {
      "type": "array",
      "items": { "type": "string", "minLength": 1, "maxLength": 500 },
      "maxItems": 50,
      "default": [],
      "description": "Explicit exclusions that prevent scope expansion."
    },
    "requirements": {
      "type": "object",
      "additionalProperties": false,
      "required": [
        "functional",
        "frontend",
        "backend",
        "data",
        "security",
        "accessibility",
        "performance"
      ],
      "description": "Category-grouped requirements. The client pre-fills a missing object with empty arrays during normalization. Empty categories are normal and preferred over invented content.",
      "properties": {
        "functional": {
          "type": "array",
          "items": { "type": "string", "minLength": 1, "maxLength": 500 },
          "maxItems": 50
        },
        "frontend": {
          "type": "array",
          "items": { "type": "string", "minLength": 1, "maxLength": 500 },
          "maxItems": 50
        },
        "backend": {
          "type": "array",
          "items": { "type": "string", "minLength": 1, "maxLength": 500 },
          "maxItems": 50
        },
        "data": {
          "type": "array",
          "items": { "type": "string", "minLength": 1, "maxLength": 500 },
          "maxItems": 50
        },
        "security": {
          "type": "array",
          "items": { "type": "string", "minLength": 1, "maxLength": 500 },
          "maxItems": 50
        },
        "accessibility": {
          "type": "array",
          "items": { "type": "string", "minLength": 1, "maxLength": 500 },
          "maxItems": 50
        },
        "performance": {
          "type": "array",
          "items": { "type": "string", "minLength": 1, "maxLength": 500 },
          "maxItems": 50
        }
      }
    },
    "edge_cases": {
      "type": "array",
      "items": { "type": "string", "minLength": 1, "maxLength": 500 },
      "maxItems": 50,
      "default": [],
      "description": "Failure states and boundary conditions the implementation must handle."
    },
    "acceptance_criteria": {
      "type": "array",
      "items": { "type": "string", "minLength": 1, "maxLength": 500 },
      "minItems": 1,
      "maxItems": 50,
      "description": "Verifiable conditions that define completion. Must not be empty."
    },
    "execution_plan": {
      "type": "array",
      "items": { "type": "string", "minLength": 1, "maxLength": 500 },
      "maxItems": 50,
      "default": [],
      "description": "Ordered implementation steps. Expected for 'deep' and 'plan' modes; optional for quick/standard."
    },
    "test_plan": {
      "type": "array",
      "items": { "type": "string", "minLength": 1, "maxLength": 500 },
      "maxItems": 50,
      "default": [],
      "description": "Targeted tests and validation commands the agent should run."
    },
    "stop_conditions": {
      "type": "array",
      "items": { "type": "string", "minLength": 1, "maxLength": 500 },
      "maxItems": 20,
      "default": [],
      "description": "Situations in which the agent must stop and ask instead of proceeding (destructive migrations, production deploys, irreversible operations)."
    },
    "final_report": {
      "type": "array",
      "items": { "type": "string", "minLength": 1, "maxLength": 256 },
      "maxItems": 20,
      "default": [],
      "description": "Reporting requirements: items the executing agent must include in its completion report (e.g. changed files, test results, assumptions, remaining risks)."
    },
    "risk_level": {
      "enum": ["low", "medium", "high"],
      "description": "Compiler's assessment of execution risk. Influences renderer emphasis on stop conditions and plan-first instructions."
    },
    "confidence": {
      "type": "number",
      "minimum": 0,
      "maximum": 1,
      "description": "Model self-assessment of specification completeness. Informational only: never rendered as a quality score."
    },
    "estimated_prompt_tokens": {
      "type": "integer",
      "minimum": 0,
      "description": "Model's own estimate of the rendered prompt size. Advisory only: the client recomputes the estimate locally."
    }
  }
}
